{
  "$schema": "carina-mod/1",
  "id": "carina-team.deep-field",
  "version": "1.0.0",
  "format": 1,
  "rulesVersion": 1,
  "phase": "content",
  "title": "Deep Field",
  "summary": "New title, galaxy map and orbit pictures with new music and button sounds. A look and sound pack: it changes no rules.",
  "authors": [
    {
      "name": "Throne of Carina team"
    }
  ],
  "license": "CC-BY-4.0",
  "allowEmbed": true,
  "allowFeature": true
}
